{
  "schema_version": 1,
  "run_id": "eval-officeqa-skillopt-example",
  "benchmark": "officeqa",
  "split_name": "test",
  "model": "deepseek-v4-flash",
  "n_total": 3,
  "n_pass": 1,
  "accuracy": 0.3333333333333333,
  "status_counts": {
    "pass": 1,
    "fail": 1,
    "timeout": 1,
    "invalid": 0,
    "infra_error": 0
  },
  "usage_totals": {
    "input_tokens": 2150,
    "output_tokens": 300,
    "total_tokens": 2450,
    "cost_usd": 0.0025,
    "usage_missing_n": 1
  },
  "refs": {
    "run_config_sha256": "21b7798e7ed052fe7fe78702025bf851ea5fe82411c7c43ad39654a5bf07b3d9",
    "results_sha256": "d54b9ed068ebbf800ef3828745a2392b2670d2853d8cf86695e0f255286ae8e5",
    "skill_sha256": "3a8ca2b1a5c8d81a9f1827364500000000000000000000000000000000000001",
    "split_manifest_sha256": "b3e78c450bf45072531727834d12277155a5e6038e06fd46401dafaf8eb3550d"
  },
  "started_at": "2026-08-31T08:00:00+00:00",
  "finished_at": "2026-08-31T08:04:12+00:00",
  "resumed": false
}
